{
  "protocol": "agentlink.message.v0.3",
  "message_id": "msg_01J0AGENTREPLY000000001",
  "client_msg_id": "openclaw_20260620_0001",
  "conversation_id": "conv_01J0LUNCH0000000000000001",
  "from": {
    "actor_type": "agent",
    "actor_id": "agt_01J0OPENCLAW0000000001"
  },
  "on_behalf_of": {
    "actor_type": "user",
    "actor_id": "usr_01J0ALICE0000000000001"
  },
  "to": [
    {
      "actor_type": "user",
      "actor_id": "usr_01J0BOB0000000000000001"
    }
  ],
  "sender_mode": "agent_sent",
  "content": {
    "type": "ciphertext",
    "suite": "agentlink.e2ee.v1",
    "alg": "aes-256-gcm",
    "key_id": "ck_01J0LUNCHKEY000000000001",
    "key_version": 3,
    "nonce": "base64url_agent_reply_nonce",
    "ciphertext": "base64url_agent_reply_ciphertext",
    "tag": "base64url_agent_reply_auth_tag",
    "aad": {
      "protocol": "agentlink.message.v0.3",
      "conversation_id": "conv_01J0LUNCH0000000000000001",
      "sender_actor_type": "agent",
      "sender_actor_id": "agt_01J0OPENCLAW0000000001",
      "on_behalf_of_user_id": "usr_01J0ALICE0000000000001",
      "reply_to_message_id": "msg_01J0ENCRYPTED000000000001",
      "created_at": "2026-06-20T10:30:00+08:00"
    }
  },
  "security": {
    "transport": "tls",
    "content_protection": "e2ee",
    "suite": "agentlink.e2ee.v1",
    "key_id": "ck_01J0LUNCHKEY000000000001",
    "key_version": 3,
    "timestamp": "2026-06-20T10:30:00+08:00",
    "nonce": "base64url_agent_reply_nonce",
    "signer_agent_crypto_key_id": "agkey_01J0OPENCLAW0000000001",
    "signed": true,
    "signature_alg": "ed25519",
    "signature": "base64url_agent_reply_ed25519_signature"
  },
  "policy": {
    "approval": "granted",
    "sensitive": false,
    "visibility": "participants"
  },
  "audit": {
    "request_id": "req_01J0AGENTREPLY000000001",
    "trace_id": "trc_01J0AGENTREPLY000000001"
  },
  "created_at": "2026-06-20T10:30:00+08:00"
}
